{"size":[1024,1536],"sea_level":0.35,"heightmap":"layers/heightmap.png","topology":"layers/wynnal-topology-web.png","biomes":{"snow":{"mask":"layers/snow_mask.png","rgb":[235,235,235]},"low_grass":{"mask":"layers/low_grass_mask.png","rgb":[120,152,86]},"farmland":{"mask":"layers/farmland_mask.png","rgb":[170,156,88]},"forest":{"mask":"layers/forest_mask.png","rgb":[48,92,54]},"marsh":{"mask":"layers/marsh_mask.png","rgb":[104,132,90]},"beach":{"mask":"layers/beach_mask.png","rgb":[196,178,120]},"mountain_grass":{"mask":"layers/mountain_grass_mask.png","rgb":[141,133,103]},"alpine_rock":{"mask":"layers/alpine_rock_mask.png","rgb":[146,140,136]}},"overlays":{"water":{"mask":"layers/water_mask.png","rgb":[34,92,124]},"rivers":{"mask":"layers/rivers_mask.png","rgb":[54,132,184]},"cities":{"mask":"layers/cities_mask.png","rgb":[156,64,44]},"roads":{"mask":"layers/roads_mask.png","rgb":[196,170,132]}}}